[
  {
    "detected_at": "2026-02-22T14:07:17.948514+00:00",
    "strategy_type": "funding_carry_cex_cex",
    "symbol": "BNB/USDT",
    "buy_venue": "long_binance_perp",
    "sell_venue": "short_bybit_perp",
    "gross_edge_bps": 0.8095,
    "fees_bps": 21.0,
    "slippage_bps": 6.4,
    "latency_risk_bps": 1.407247,
    "transfer_delay_min": 1.0,
    "size_usd": 10000,
    "notes": "funding_diff_bps=(short bybit 0.809 - long binance 0.000); hold_min=112.67; skew_min=0.00; mark_long=619.018382; mark_short=618.500000"
  },
  {
    "detected_at": "2026-02-22T14:07:17.948514+00:00",
    "strategy_type": "funding_carry_cex_cex",
    "symbol": "LTC/USDT",
    "buy_venue": "long_binance_perp",
    "sell_venue": "short_bybit_perp",
    "gross_edge_bps": 0.7802,
    "fees_bps": 21.0,
    "slippage_bps": 6.4,
    "latency_risk_bps": 1.407247,
    "transfer_delay_min": 1.0,
    "size_usd": 10000,
    "notes": "funding_diff_bps=(short bybit 0.102 - long binance -0.678); hold_min=112.67; skew_min=0.00; mark_long=53.300000; mark_short=53.310000"
  },
  {
    "detected_at": "2026-02-22T14:07:17.948514+00:00",
    "strategy_type": "funding_carry_cex_cex",
    "symbol": "DOGE/USDT",
    "buy_venue": "long_binance_perp",
    "sell_venue": "short_bybit_perp",
    "gross_edge_bps": 0.6234,
    "fees_bps": 21.0,
    "slippage_bps": 6.4,
    "latency_risk_bps": 1.407247,
    "transfer_delay_min": 1.0,
    "size_usd": 10000,
    "notes": "funding_diff_bps=(short bybit -0.351 - long binance -0.974); hold_min=112.67; skew_min=0.00; mark_long=0.095850; mark_short=0.095860"
  },
  {
    "detected_at": "2026-02-22T14:07:17.948514+00:00",
    "strategy_type": "funding_carry_cex_cex",
    "symbol": "AVAX/USDT",
    "buy_venue": "long_binance_perp",
    "sell_venue": "short_bybit_perp",
    "gross_edge_bps": 0.5937,
    "fees_bps": 21.0,
    "slippage_bps": 6.4,
    "latency_risk_bps": 1.407247,
    "transfer_delay_min": 1.0,
    "size_usd": 10000,
    "notes": "funding_diff_bps=(short bybit 0.398 - long binance -0.196); hold_min=112.67; skew_min=0.00; mark_long=8.893205; mark_short=8.894000"
  },
  {
    "detected_at": "2026-02-22T14:07:17.948514+00:00",
    "strategy_type": "funding_carry_cex_cex",
    "symbol": "ADA/USDT",
    "buy_venue": "long_binance_perp",
    "sell_venue": "short_bybit_perp",
    "gross_edge_bps": 0.5749,
    "fees_bps": 21.0,
    "slippage_bps": 6.4,
    "latency_risk_bps": 1.407247,
    "transfer_delay_min": 1.0,
    "size_usd": 10000,
    "notes": "funding_diff_bps=(short bybit -0.865 - long binance -1.440); hold_min=112.67; skew_min=0.00; mark_long=0.272600; mark_short=0.272500"
  },
  {
    "detected_at": "2026-02-22T14:07:17.948514+00:00",
    "strategy_type": "funding_carry_cex_cex",
    "symbol": "XRP/USDT",
    "buy_venue": "long_binance_perp",
    "sell_venue": "short_bybit_perp",
    "gross_edge_bps": 0.4919,
    "fees_bps": 21.0,
    "slippage_bps": 6.4,
    "latency_risk_bps": 1.407247,
    "transfer_delay_min": 1.0,
    "size_usd": 10000,
    "notes": "funding_diff_bps=(short bybit -0.820 - long binance -1.312); hold_min=112.67; skew_min=0.00; mark_long=1.397800; mark_short=1.397800"
  },
  {
    "detected_at": "2026-02-22T14:07:17.948514+00:00",
    "strategy_type": "funding_carry_cex_cex",
    "symbol": "BTC/USDT",
    "buy_venue": "long_bybit_perp",
    "sell_venue": "short_binance_perp",
    "gross_edge_bps": 0.4098,
    "fees_bps": 21.0,
    "slippage_bps": 6.4,
    "latency_risk_bps": 1.407247,
    "transfer_delay_min": 1.0,
    "size_usd": 10000,
    "notes": "funding_diff_bps=(short binance 0.267 - long bybit -0.143); hold_min=112.67; skew_min=0.00; mark_long=67537.100000; mark_short=67538.500000"
  }
]