[
  {
    "detected_at": "2026-02-22T18:03:11.883079+00:00",
    "strategy_type": "cex_dex",
    "symbol": "SOL/USDT",
    "buy_venue": "jupiter",
    "sell_venue": "binance",
    "gross_edge_bps": 2.045652,
    "fees_bps": 11.501661,
    "slippage_bps": 1.7705,
    "latency_risk_bps": 3.036348,
    "transfer_delay_min": 12.0,
    "size_usd": 5000.0,
    "notes": "buy_dex_sell_cex dex_ask=83.05301025 cex_bid=83.07000000 dex_spread=0.00bps dex_impact=0.62bps dex_router_fee=4.0000bps dex_network_fee=0.001661bps source=network_friction:network_friction_v1"
  },
  {
    "detected_at": "2026-02-22T18:03:11.883079+00:00",
    "strategy_type": "cex_dex",
    "symbol": "SOL/USDT",
    "buy_venue": "jupiter",
    "sell_venue": "bybit",
    "gross_edge_bps": 0.841601,
    "fees_bps": 14.001661,
    "slippage_bps": 1.77058,
    "latency_risk_bps": 3.132672,
    "transfer_delay_min": 12.0,
    "size_usd": 5000.0,
    "notes": "buy_dex_sell_cex dex_ask=83.05301025 cex_bid=83.06000000 dex_spread=0.00bps dex_impact=0.62bps dex_router_fee=4.0000bps dex_network_fee=0.001661bps source=network_friction:network_friction_v1"
  }
]