[
  {
    "detected_at": "2026-02-22T04:01:36.956095+00:00",
    "strategy_type": "cex_dex",
    "symbol": "SOL/USDT",
    "buy_venue": "jupiter",
    "sell_venue": "binance",
    "gross_edge_bps": 3.148885,
    "fees_bps": 11.5,
    "slippage_bps": 1.508201,
    "latency_risk_bps": 2.948089,
    "transfer_delay_min": 12.0,
    "size_usd": 5000.0,
    "notes": "buy_dex_sell_cex dex_ask=85.10320198 cex_bid=85.13000000 dex_spread=0.00bps dex_impact=0.12bps"
  },
  {
    "detected_at": "2026-02-22T04:01:36.373669+00:00",
    "strategy_type": "cex_cex",
    "symbol": "SOL/USDT",
    "buy_venue": "bybit",
    "sell_venue": "binance",
    "gross_edge_bps": 2.3499,
    "fees_bps": 17.5,
    "slippage_bps": 2.492293,
    "latency_risk_bps": 1.36501,
    "transfer_delay_min": 5.0,
    "size_usd": 10000,
    "notes": "live_top_of_book buy_ask=85.11000000, sell_bid=85.13000000, buy_spread=1.175bps, sell_spread=1.175bps"
  },
  {
    "detected_at": "2026-02-22T04:01:36.373669+00:00",
    "strategy_type": "cex_cex",
    "symbol": "BNB/USDT",
    "buy_venue": "binance",
    "sell_venue": "bybit",
    "gross_edge_bps": 0.965344,
    "fees_bps": 17.5,
    "slippage_bps": 2.173233,
    "latency_risk_bps": 1.503466,
    "transfer_delay_min": 5.0,
    "size_usd": 10000,
    "notes": "live_top_of_book buy_ask=621.54000000, sell_bid=621.60000000, buy_spread=0.161bps, sell_spread=1.609bps"
  }
]